{
  "id": "micu",
  "name": "micu",
  "website": null,
  "currency": "CNY",
  "updated_at": "2026-09-10",
  "source_url": null,
  "models": [
    {
      "model": "gpt-5.5",
      "input": 1,
      "output": 6
    },
    {
      "model": "gpt-5.6-luna",
      "input": 0.04,
      "output": 0.24,
      "cached_input": 0.004
    },
    {
      "model": "gpt-5.6-sol",
      "input": 1,
      "output": 6
    },
    {
      "model": "gpt-5.6-terra",
      "input": 0.4,
      "output": 2.4
    },
    {
      "model": "gpt-6-astra",
      "input": 2,
      "output": 10
    }
  ]
}
